titles,links,rating_BoardGameGeeks,user_ratings,tesera_ratings,english_names,number_of_playerss,ages,time_per_games,image_urls,short_descriptions,descriptions
The Castles of Burgundy: Special Edition,https://tesera.ru/game/castles-of-burgundy-special-edition,7.83,9.26,8.61,2023,1 - 4,от 12 лет,от 60 мин,"https://s.tesera.ru/images/items/2061209,3/200x200xpa/photo1.jpg","Замки Бургундии — легендарная настольная игра, созданная Стефаном Фельдом. В этой настольной игре для 1–4 игроков вы возьмете на себя роль аристократа, управляющего небольшим княжеством в Бургундии, в средневековой Франции. Пытайтесь построить...","Замки Бургундии— легендарная настольная игра, созданная Стефаном Фельдом. В этой настольной игре для 1–4 игроков вы возьмете на себя роль аристократа, управляющего небольшим княжеством в Бургундии, в средневековой Франции. Пытайтесь построить поселение с мощными замками, занимайтесь ремеслом, эксплуатируйте серебряные рудники и используйте знания путешественников.Теперь эта игра возвращается с чрезвычайно облагороженным, высококачественнымспециальным изданием, созданным в результате сотрудничества Ravensburger и Awaken Realms.В этом выпуске вы можете ожидать полного изменения дизайна, чтобы гарантировать, что каждый элемент будет иметь великолепное оформление и повысит удобство использования в игре.Будут использоваться только лучшие материалы, чтобы обеспечить долговечность и ощущение премиум-класса. Множество дополнительных компонентов выведут игровой процесс на новый уровень, например, двухслойные игровые поля, специальные мешочки для гексов, плитки на 30% большего размера или металлические монеты."
Сквозь века: Новая история цивилизации,https://tesera.ru/game/through-ages-new-story-civilization,8.08,8.60,8.58,"Through the Ages: A New Story of Civilization, 2015",2 - 4,от 14 лет,180 - 240 мин,"https://s.tesera.ru/images/items/602585,3/200x200xpa/photo1.jpg","Сквозь века. Новая история цивилизации – монументальная игра-цивилизация с отточенным десятилетиями балансом. Грандиозная и серьезная игра для опытных стратегов, готовых вершить судьбы целых народов.","Сквозь Векапо праву можно назвать одной из самых разнообразных и сбалансированных настольных стратегий. Вы начнете игру в равных с остальными условиях, управляя малочисленным племенем, способным добывать простейшие ресурсы и небольшое количество пищи. Шахта, производящая непрочную бронзу, да ферма, обитатели которой имеют лишь базовые представления о земледелии – все, что есть у вас на старте. Дальнейшее развитие полностью зависит от ваших решений и выбранной стратегии.Игрокам предстоит пройти через 4 условные эпохи – от античности до эры информации. Каждый ход вы будете тратить очки действий на изучение технологий, увеличение численности населения, а также постройку и улучшение зданий, обучение отрядов и многое другое.Умело распоряжайтесь населением своей цивилизации. Игра постоянно ставит перед вами сложные вопросы: “Не отправить ли ученых работать на фермы, чтобы обеспечить свой народ пищей?” или “Не переобучить ли рабочих в солдат, а в свой следующий ход объявить войну соседу?”. Но не забывайте – чем многочисленнее население вашей цивилизации, тем больше еды оно потребляет и тем больше от вас требуется усилий, чтобы оно было довольно. Недовольные жители и вовсе могут поднять восстание."
Осквернённый Грааль. Падение Авалона,https://tesera.ru/game/tainted-grail-the-fall-of-avalon,7.56,8.62,8.58,"Tainted Grail: The Fall of Avalon, 2019",1 - 4,от 14 лет,120 - 240 мин,"https://s.tesera.ru/images/items/1341302,3/200x200xpa/photo1.jpg",«Осквернённый Грааль. Падение Авалона» — это полностью кооперативная приключенческая настольная игра для 1—4 участников. Её главными особенностями являются открытый мир и разветвлённый сюжет.,"«Осквернённый Грааль. Падение Авалона» — это полностью кооперативная приключенческая настольная игра для 1—4 участников. Её главными особенностями являются открытый мир и разветвлённый сюжет. Это хит издательства Awaken Realms, известного по серии игр«Это моя война»(This War of Mine).События «Осквернённого Грааля» разворачиваются в мрачном фэнтезийном мире, вдохновлённом легендами о короле Артуре, а также кельтской и скандинавской мифологией.Взяв на себя роль одного из четырёх героев поневоле, вы будете исследовать большой мистический мир, выполнять судьбоносные миссии и куда более скромные поручения местных жителей. Вы станете участником множества событий, многие из которых будут развиваться в зависимости от ваших решений. Вы проживёте кампанию из 15 последовательных глав и всё равно не увидите всех локаций и не откроете всех карт событий."
Проект «Гайя»,https://tesera.ru/game/gaia-project,8.13,8.61,8.57,"Gaia Project, 2017",1 - 4,от 12 лет,60 - 120 мин,"https://s.tesera.ru/images/items/937523,3/200x200xpa/photo1.jpg","Проект «Гайя» (Gaia Project) – это глубокая экономическая стратегия про колонизацию космоса, которую можно назвать ремейком Терры Мистики со своими особенностями, технологиями и фракциями.","""Проект Гайя"" — это очень глубокая экономическая стратегия про колонизацию космоса. Игра является переосмысленной и улучшенной вариацией культовой и высоко оценённой игры ""Терра Мистика"", в которой вам также необходимо было взять под свой контроль одну из доступных рас и привести её к победе, грамотно управляя доступными ресурсами, захватывая соседние земли и превращая их в пригодные территории для обитания своей расы.Общая концепция осталась прежней. Само действие игры перенеслось в космос, в галактику ""Терра Мистика"". Вам всё так же доступно четырнадцать различных рас, которые достаточно сильно отличаются друг от друга по игровому процессу и стратегии. В совокупности с огромным модульным полем и разными заданиями на раунды, игра становится безумно реиграбельной.В игре семь типов планет, каждый пригоден лишь для двух рас. Поэтому игрокам предстоит во всю пользоваться новейшей технологией — терраформированием планет и превращать их в пригодные для обитания своей расы. Как и раньше быть соседом выгоднее, но вы можете колонизировать и дальние планеты, став настоящим отшельником. Помимо всего этого, игрокам необходимо будет заниматься развитием науки и технологий, возводить новые строения на своих планетах, формировать из них целевые федерации и стараться выполнять различные задания, зарабатывая этим как можно больше победных очков."
Остров духов. Ветви и когти,https://tesera.ru/game/Spirit-Island-Branch-and-Claw,8.01,8.79,8.55,"Spirit Island: Branch & Claw, 2017",1 - 4,от 14 лет,90 - 180 мин,"https://s.tesera.ru/images/items/1121739,3/200x200xpa/photo1.jpg","Дополнение к Spirit Island, вводящее новые механики событий и жетонов напастей, а также включающее новых духов, нового противника и новые карты всех типов.","Это дополнение к игре Spirit Island включает двух новых духов; нового противника - Францию; и новые механики событий и жетонов напастей.Карты из колоды событий отражают непредсказуемые вещи, случающиеся перед ходом захватчиков - прибытие миссионеров, наплыв чужеродных животных и растений, всплески эпидемий.Жетоны напастей размещаются в районы острова разными событиями и духами и мешают пришельцам покорять остров. Непроходимые заросли предотвращают исследование, болезни замедляют постройку, а распри ослабляют попытки захватчиков разорить территории, где эти жетоны находятся. Жетоны диких зверей иногда нападают на колонистов.Дополнение включает в себя новые карты Сил (31 малая и 21 великая), использующие эти жетоны; новые карты страха, загрязненного острова и новые сценарии."
Pax Renaissance. Русское издание,https://tesera.ru/game/pax-renaissance-second-edition,6.86,8.68,8.55,2021,1 - 4,от 12 лет,60 - 120 мин,"https://s.tesera.ru/images/items/1660885,3/200x200xpa/photo1.png","Проработанная стратегия на построение планшета, скрупулёзно интегрирующая исторические события в игровые механики. Как банкир эпохи Возрождения, вы будете финансировать королей или республики, спонсировать путешествия и открытия, присоединяться к...","Как банкир эпохи Возрождения, вы будете финансировать королей или республики, спонсировать путешествия и открытия, присоединяться к тайным сообществам и даже устраивать джихады и инквизиции. Ваши действия определят, перейдёт ли Европа в светлую современную эпоху или останется в тёмном феодализме. Четыре пути определяют будущий курс развития западного общества: к империализму, торговой глобализации, религиозному тоталитаризму или просвещённому искусству и науке.Получать престиж и карты, необходимые для победы, вы будете в основном запуская цепочки действий, изображённые на картах, которые вы будете покупать и размещать на своём планшете. Каждое действие может приводить к разным результатам, в зависимости от расположения на картах и поле ладей, слонов и коней (сил трёх мировых религий) и пешек (ваших и соперников).В свой ход вы можете совершить до двух действий из шести доступных. Вы можете: купить карту; разыграть её в ряд карт на своём планшете; продать карту; провести операцию (использовать свойства карт на вашем планшете) и организовать торговую ярмарку (грубо говоря, запустить процесс, приносящий деньги игрокам в зависимости от расстановки сил на карте). После хода игрока наступает фаза обновления рынка: все карты сдвигаются и на освободившееся место выкладываются новые карты.Операции делятся на 4 вида:Религиозные. Позволяют блокировать слонами нежелательные для вас эффекты и операции на картах оппонентов, освобождать захваченные на картах фишки и уничтожать чужих слонов.Экономические. Помогут вам получить флорины, лежащие на рынке.Политические — самый широкий спектр действий. Вы можете сбросить карту из любого банка, лишить оппонента денег или пешки на игровом поле, угнести или уничтожить фишку или инициировать смену власти в империи путём выборов.Военные. Нацелены на уничтожение и перемещение (различными способами) нежелательных для вас фишек на игровом поле.Чтобы победить в этой игре, также нужно потратить действие. В каждом ряду рынка (ближе к концу колоды) замешивается по две карты комет. Покупка такой карты позволит вам активировать одно из четырёх условий победы, сделав его доступным для всех игроков. И если в свой ход вы выполняете такое условие, вам нужно всего лишь потратить действие, чтобы объявить о победе и стать самым влиятельным банкиром континента.Отличия от первого издания:Новые компоненты: деревянные фишки пиратских кораблей, пешки, обозначающие концессии и сервов, планшеты банков, квадратные карты победы и правителей. Также теперь в игре есть жетоны гербов, которые можно помещать в пустые ячейки престолов, обозначая, кто контролирует ту или иную империю.Дополнительные карты империй. Позволяют при необходимости провести партию без игрового поля.Руководство игрока. Включает разделы «Одиночная игра», «Пример игры» и «Стратегия».В игре появилось разовое действия отречения, одиночный режим, карты «Торговый флот Далмации» и «Криптография», а также карты с эффектом «Кондотьер».Новый центр торговли и торговый путь. Теперь белый торговый путь начинается в Красном море.Ячейки престолов. Если карта правителя не находится ни в чьём банке, его карта королевы, слон и угнетённые фишки хранятся вместе с ним в ячейке престола.Теперь во всех кампаниях доступны 4 государственных режима. В вашей партии может появиться феодальная Папская область, католическая Англия, протестантская Греция и другие вариации, невозможные в первом издании."
Brass. Ланкашир,https://tesera.ru/game/brass-lancashire,7.96,8.56,8.52,"Brass: Lancashire, 2018",2 - 4,от 14 лет,60 - 120 мин,"https://s.tesera.ru/images/items/959581,3/200x200xpa/photo1.png","Brass. Ланкашир (Brass: Lancashire) — игра, в которой необходимо проявить свою предпринимательскую жилку. Участники партии — бизнесмены, которые развивают свое дело в 1770-1870 годах.","Это история о конкурирующих предпринимателях в период английской промышленной революции в 1770—1870 годах. Название игры Brass можно перевести на русский как «медяки». В обиходе этим словом именовали медные монеты самого низкого номинала. Существовала поговорка: where there’s muck there’s brass, что примерно означает «грязи бояться — без медяков остаться».«Brass. Ланкашир» — переизданная версия настольной игры Brass. Изменился внешний вид игры, а правила были немного доработаны. Все игровые действия выполняются с помощью карт. Партия состоит из нескольких раундов, количество которых зависит от количества участников в игре. Игрокам доступны следующие действия (два в ход):Строительство предприятия. За некоторые необходимо будет заплатить углём или железом.Модернизация собственных предприятий. Игроки сбрасывают предприятия меньших уровней, чтобы открыть доступ к более сильным предприятиям, приносящим больший доход или большее количество победных очков.Развитие путей водного и железнодорожного сообщения от локаций, уже входящих в вашу транспортную сеть, к новым местам.Продажа произведённых товаров. Производственные здания, соединённые сетью дорог с рынком, дают возможность обменять товары на деньги или победные очки.Получение денег в качестве ссуды.Партия длится две игровые эпохи: эпоху каналов (1770—1830) и эпоху железных дорог (1830—1870). В игре побеждает предприниматель, накопивший больше всех победных очков по завершении эпохи железных дорог.Ограничение по картам, действиям и оригинальный порядок хода открывают перед игроками интересные стратегические возможности: игрокам предстоит точно рассчитывать, где и когда поставить новую фабрику, и с умом выбирать время для продажи товаров и развития транспортной сети.«Brass. Ланкашир» и «Brass. Бирмингем» базируются на одних и тех же механиках, но отличий в правилах достаточно, и обе игры обладают своим темпом и своим набором разных путей к победе. В любом случае оригинальная концепция ссуд как игровой механики, придуманная Мартином Уолессом, в сочетании с логистическими задачами сделали Brass современной классикой.Внимание!Опечатка в правилах.В русских правилах игры на странице 7 в пункте 5 предложение «Объедините карты из стопок сброса всех игроков...» следует понимать как «Объедините картыиз-под жетона эпохи ииз стопок сброса всех игроков...»."
