titles,links,rating_BoardGameGeeks,user_ratings,tesera_ratings,english_names,number_of_playerss,ages,time_per_games,image_urls,short_descriptions,descriptions
Pax Pamir. Большая игра,https://tesera.ru/game/pax-pamir-second-edition,7.80,8.48,8.44,"Pax Pamir: Second Edition, 2019",1 - 5,от 13 лет,45 - 140 мин,"https://s.tesera.ru/images/items/1341975,3/200x200xpa/photo1.jpg","Pax Pamir. Большая игра — необычная историческая игра-гибрид, в которой каждый участник принимает на себя роль афганского лидера девятнадцатого века, пытающегося создать новое государство после краха Дурранийской империи","Pax Pamir. Большая игра — необычная историческая игра-гибрид, в которой каждый участник принимает на себя роль афганского лидера девятнадцатого века, пытающегося создать новое государство после краха Дурранийской империи.Второе издание основано на оригинальной игре Фила Эклунда и переработано Коулом Верлем.По игровому процессу Pax Pamir представляет собой конфликтную игру на построение планшета. В свой ход игроки либо покупают карты с общего рынка либо разыгрывают их, либо используют свойства уже лежащих перед собой карт. С помощью действий они выставляют свои диски в регионы на карте или на карты других игроков.В каждый момент игры участник должен быть лоялен одной из коалиций: Британской империи, Российской империи или Афганистану. Результаты всех действий в игре зависят от того, какой коалиции лоялен каждый участник.В колоде есть четыре карты запускающие подсчёт очков. Очки получают игроки, лояльные коалиции, которая в настоящий момент имеет больше всего влияния. Если не достигнута лидерства ни одной коалиции, игроки получают очки в зависимости от личного влияния.Карты и их свойства, позволяют получать влияние (располагать свои войска в регионах, войска дружественных коалиций, атаковать чужие войска) и необходимые для его получения шаги (сменить лояльность, послать шпиона, уничтожить чужую карту, спровоцировать какое-либо историческое событие).Хотя каждый игрок  строит свой собственный ряд карт, игра предлагает множество способов для игроков вмешиваться в планы друг друга, как прямо, так и косвенно."
Иниш,https://tesera.ru/game/Inis,7.54,8.44,8.42,"Inis, 2016",2 - 4,от 12 лет,40 - 60 мин,"https://s.tesera.ru/images/items/516061,3/200x200xpa/photo1.jpg","Inis предлагает игрокам окунуться в кельтские мифы и решить, кому достанется титул короля Острова. Проиллюстрировал игру Джим Фицпатрик - знаменитый ирландский художник.","Inis предлагает игрокам окунуться в кельтские мифы и решить, кому достанется титул короля Острова (именно так переводится Inis с кельтского). Игрок может победить, выполнив на конец раунда одно из трёх победных условий: если фишки игрока есть в шести разных регионах игрового поля; если в подконтрольных игроку регионах есть по меньшей мере 6 фишек соперников (регион под контролем игрока, чьих фишек в нём больше); если в регионах, где есть фишки игрока, есть по меньшей мере 6 жетонов святынь.В начале каждого раунда игроки получают по четыре карты действий посредством драфта: игрок получает четыре карты из колоды действий, одну оставляет себе, а оставшиеся передаёт соседу, оставляет одну из полученных от одного соседа карт, а оставшиеся передают другому соседу и т.д. В какую сторону передаются карты, зависит от номера раунда. Неиспользованные карты действий в конце раунда сбрасываются. Также игрок добирает карты из колоды лидеров, если контролирует соответствующие регионы. Ещё есть карты легенд (богов и героев), которые добираются игроками во время партии и дают доступ к самым мощным эффектам. Карты лидеров и легенд можно держать на руке до использования.Во время раунда игроки по очереди разыгрывают по карте. Эффекты карт позволяют выкладывать на поле новые регионы, жетоны святынь или фишки своих кланов, перемещать фишки между регионами, атаковать соперника (тот вынужден сбросить фишку с поля или карту с руки) и т.д.Проиллюстрировал игру Джим Фицпатрик (Jim Fitzpatrick) — ирландский художник, знаменитый своими картинами по мотивам кельтских мифов, автор сверхпопулярного портрета кубинского революционера Че Гевары, в основу которого лёг снимок «Героический партизан» кубинского фотографа Альберто Корды.Inis входит в серию XL компании Matagot. Другие игры серии: Cyclades («Киклады»), Giants, Kemet, Khronos и Utopia. В Matagot решили отказаться от больших продолговатых коробок, в которых выпущены другие игры серии XL, и Inis вышла в стандартной «немецкой большой квадратной коробке» (как, например, у «Колонизаторов»).В 2010 году игра была известна как Inis Kelt, а с 2013 — как Brenn. Должна была выйти к выставке Spiel-2014, где в итоге присутствовала только в виде прототипа, собранного из элементов других игр компании Matagot."
Пути славы,https://tesera.ru/game/Paths-of-Glory,7.29,8.72,8.42,"Paths of Glory, 1999",2,от 14 лет,от 480 мин,"https://s.tesera.ru/images/items/13241,3/200x200xpa/photo1.jpg","Пути Славы – дуэльная игра, которая симулирует Первую мировую войну в увлекательном и исторически достоверном виде. Пройдите всю кампанию от 1914 до 1918 года или начните с малого, сыграв первые несколько ходов в самом начале войны.","Пути Славы– дуэльная игра, которая симулирует Первую мировую войну в увлекательном и исторически достоверном виде. Пройдите всю кампанию от 1914 до 1918 года или начните с малого, сыграв первые несколько ходов в самом начале войны. В любом случае получится настоящее стратегическое противостояние, в котором у каждой стороны свои сильные и слабые стороны, а значит и свой путь к победе.Пути Славы– действительно глобальная стратегия, которая охватывает все фронты Первой мировой войны, от Северной Африки до Балкан, от Прибалтики до Бельгии. Вам предстоит управлять не отдельными солдатами, даже не ротами и взводами, а десятками армий и корпусов из разных стран, как настоящему главнокомандующему.Корпуса и армии и являются основными боевыми соединениями в игре. Корпуса насчитывают от 20 000 до 50 000 человек и представлены малыми фишками. Армии – куда более серьёзные соединения (до 300 000 человек). Также в игре есть две колоды по 65 карт – колода союзников и колода Центральных держав. Вы начинаете игру с семью картами, каждую из которых можете разыграть как мощное событие или как очки операций. В первом случае вы можете получить немалое преимущество, но и карта, вероятнее всего, уйдёт из игры навсегда. А во втором варианте вы можете потратить полученные очки на активацию соединений, чтобы отправить их в бой.Кстати, каждая карта – это реальное историческое событие, о котором можно узнать чуть подробнее из книги правил. И это отличная возможность получить новые знания о Великой войне."
Осквернённый Грааль. Кампании «Эпоха лег,https://tesera.ru/game/tainted-grail-age-of-legends-last-knight-campaigns,6.18,9.37,8.41,"Tainted Grail: Age of Legends & Last Knight Campaigns, 2020",1 - 4,от 14 лет,120 - 180 мин,"https://s.tesera.ru/images/items/1831386,3/200x200xpa/photo1.jpg","Дополнение для игры «Осквернённый Грааль», включающее две кампании, одна из которых повествует о прошлом Авалона, а вторая — о будущем.","Осквернённый Грааль. Кампании «Эпоха легенд» и «Последний рыцарь» — дополнение для игры «Осквернённый Грааль», включающее две кампании, одна из которых повествует о прошлом Авалона, а вторая — о будущем.Действие «Эпохи легенд» происходит за шестьсот лет до событий «Падения Авалона».Вам предстоит стать первопроходцем Авалона и присоединиться к рыцарям Круглого стола в их поисках и испытаниях. Вы застанете империю предтеч на пике могущества. Кампания состоит из 15 новых глав (30—40 часов игрового процесса) и добавляет 4 новых персонажей.История же, рассказанная в «Последнем рыцаре», разворачиваетсячерез 400 лет после сюжета основной кампании. Главная особенность в том, что вы столкнётесь с последствиями действий, совершённых в «Падении Авалона». Теперь вы будете путешествовать по холодному пустынному ландшафту апокалиптического Авалона в поисках ответов и, возможно, спасения. Кампания состоит так же из 15 новых глав и добавляет ещё 4 новых персонажей."
StarCraft: The Board Game - Brood War Ex,https://tesera.ru/game/StarCraft-Brood-War,6.67,8.61,8.40,2008,2 - 6,от 12 лет,90 - 240 мин,"https://s.tesera.ru/images/items/2826,3/200x200xpa/photo1.jpg","Brood War - дополнение к известной настольной игре StarCraft, которое включает в себя новых юнитов и планет. Также здесь появляется возможность разыгрывать различные сценарии из компьютерной игры.","Улей Зергов разрушен и терзается распрями изнутри. Протоссы стремятся воссоединиться со своими братьями, Темными тамплиерами, для восстановление их родного мира, Аиура.Терранский Император Менгск I, добившись желанного конnроля над всеми человеческими колониями, столкнулся лицом к лицом к лицу с двумя угрозами. С одной стороны - растущая власть женщины, которую он предал. Сара Керриган, известная как Королева Клинков. С другой - злобный заговор глубоко в собственных рядах...Данное дополнение значительно расширяет игровую механику базовой игры. Например, если раньше сидеть в стороне было не самой лучшей идеей, то теперь появляется специальный приказ для защиты. Кроме того, появились все юниты из первоисточника, и для их постройки в коробку вложены шесть новых листов Фракций.Также появляется несколько нововведений:*Герои. Сильные юниты, которые способны повлиять на исход битвы. Не гибнут от Вторичного урона.*Сценарии. Миссии основанные на событиях игры. Они предлагают новый способ игры.*Карты лидерства. Карты лидерства обеспечивают каждую фракцию уникальными и мощными возможностями, что позволяет еще больше расширить стратегию в игре.В целом, дополнение, как и положено, раскрывает игру, делает её ещё глубже и интереснее."
