titles,links,rating_BoardGameGeeks,user_ratings,tesera_ratings,english_names,number_of_playerss,ages,time_per_games,image_urls,short_descriptions,descriptions
Runewars: Banners of War,https://tesera.ru/game/Runewars-Banners-of-War,6.48,8.81,8.51,2011,2 - 4,,,"https://s.tesera.ru/images/items/53040,3/200x200xpa/photo1.jpg","Banners of War - первое дополнение к Runewars (стратегической игре в стиле фэнтези). Сюда входят разнообразные карты, фрагменты игрового поля, жетоны, метки и пластиковые миниатюры.","Banners of War — первое дополнение к стратегической игре в стиле фэнтези Runewars. Помимо разнообразных карт, фрагментов игрового поля, жетонов и меток в состав «Знамён Войны» входят 50 пластиковых миниатюр, представляющих новых бойцов для каждой из четырёх представленных в игре фракций — все фракции получат по два новых вида войск. Кроме того, в «Знамёна Войны» входят несколько опциональных вариантов игры, которые применяются в любой комбинации и позволяют игрокам создать свои «Рунные войны», которые устраивают лично их.При использовании опционального варианта «Командующие на поле боя» герои не остаются в стороне от сражений и могут участвовать в них, помогая своим войскам при помощи специальных карт командующих. Также дополнение включает 32 новые карты, которые можно замешать в колоду тактики. Их часть относится к новому виду карт, которые можно использовать и в качестве карт тактики, и в качестве карт судьбы во время боя.Вторым важным необязательным нововведением являются карты развития, «пристройки» к листам фракций, позволяющие задавать стратегию и обеспечивать собственный стиль игры игрока.Вариант «Восход Вольных городов» заменяет существующие жетоны городов более ценными, дающими больше влияния, карт тактики, войск и даже драконьи руны."
Покорение Марса,https://tesera.ru/game/terraforming-mars,8.22,8.52,8.51,"Terraforming Mars, 2016",1 - 5,от 12 лет,120 - 180 мин,"https://s.tesera.ru/images/items/526664,3/200x200xpa/photo1.jpg","Покорение Марса (Terraforming Mars) – стратегическая игра, в которой участники выступают за одну из корпораций, желающей изменить планету Марс до условий, пригодных для жизни человеческой цивилизации.","В 2400-х человечество начинает терраформировать планету Марс. Гигантские корпорации, созданные по инициативе Всемирного правительства на Земле, инициируют масштабные проекты, чтобы поднять температуру, уровень кислорода и покрыть океанами планету Марс до условий, пригодных для жизни. В Terraforming Mars вы играете за одну из этих корпораций и работаете вместе в процессе терраформирования, но конкурируете за получение победных очков, которыми награждаетесь не только за вклад в терраформинг, но и за развитие человеческой инфраструктуры во всей Солнечной системе.Игроки приобретают уникальные карты проектов (существует более 200 различных видов). Проекты (карточки) могут представлять что-нибудь от внедрения растительной или животной жизни, спуска астероидов на поверхность и строительства городов до добычи полезных ископаемых на спутниках Юпитера и развития отрасли по производству парниковых газов для нагрева атмосферы. Карты могут дать вам немедленные бонусы, а также увеличение вашего производства различных ресурсов. Многие карты также имеют условия применения, они становятся доступными, когда температура, кислород или покрытие поверхности океаном достигают определённого уровня. Когда процесс терраформинга завершён, игра заканчивается, и вы считаете свои победные очки, чтобы увидеть, кто победил."
Канбан. Электро,https://tesera.ru/game/kanbanev,7.73,8.63,8.51,"Kanban EV, 2020",1 - 4,от 14 лет,60 - 180 мин,"https://s.tesera.ru/images/items/1488119,3/200x200xpa/photo1.jpg","Тема игры Kanban EV (Electric Vehicles) - сборочная линия электромобилей. Игроки - это амбициозные менеджеры, которые пытаются произвести впечатление на совет директоров.","Kanban EV(Electric Vehicles) будет представлен в новом дизайне от Яна О'Тула, с роскошными компонентами, официальной сольной версией, новыми картами и полностью переписанными правилами.Kanban— японское слово, обозначающее рекламный щит - это термин, обозначающий визуальные подсказки, которые можно использовать на сборочной линии, чтобы ускорить и сделать более эффективным рабочий процесс. Эти сигналы дают работникам то, что им нужно, где им это нужно и когда им это нужно для создания производственной системы «точно в срок» (JIT).Тема игры Kanban EV - сборочная линия электромобилей. Игроки - это амбициозные менеджеры, которые пытаются произвести впечатление на совет директоров, чтобы достичь как можно более высоких позиций в компании и обеспечить себе карьеру.В течение игры вы разрабатываете и улучшаете автомобильные детали. Вы проницательно используете внешних поставщиков и ограниченные заводские поставки, чтобы подобрать необходимую деталь, когда поставщики испытывают их нехватку. Поскольку фабрика должна работать с оптимальной эффективностью, производство не прощает задержек или ошибок.Как и сам процесс, Kanban Electric Vehicles оказывается инновационным и полезным. В игре представлены такие элементы, тесно связанные с темой производства автомобилей, как:Менеджер фабрики— это неигровой персонаж, управляемый игрой, с двумя режимами игры («добрый» или «злой»), предлагающий дружественную или более конкурентную игровую среду.Два независимых влияющих на игрока таймера игры— заводской цикл производства и часы рабочей недели - обеспечивают временную напряженность в игре, запускают промежуточные этапы подсчета очков и учитывают условия окончания игры.Симуляция заводской сборочной линии с пространственным движением от точки к точке добавляет в игру элемент, который требует оптимального распределения времени.Отдел дизайна и инноваций, задействованный для управления стоимостью различных моделей автомобилей и модернизаций компонентов, производимых на заводе, стимулирует экономику.Ведомственные учебные и сертификационные треки дают игрокам возможность работать более эффективно.Если вы хотите занять место на поле, вам нужно показать, что вы можете обеспечить бесперебойную и эффективную работу сложного механизма, когда все происходит в нужное время.Kanban EV — это чистая евроигра, ориентированная на экономику и управление ресурсами, которая ставит вас на место управляющего всего производственного объекта."
The Castles of Burgundy (20th Anniversar,https://tesera.ru/game/the-castles-of-burgundy-2019,7.89,8.58,8.50,"Замки Бургундии (Юбилейное издание), 2019",1 - 4,от 12 лет,60 - 100 мин,"https://s.tesera.ru/images/items/1401948,3/200x200xpa/photo1.jpg","Издание ""Замков Бургундии"" 2019 года включает в себя одиннадцать расширений, десять из которых ранее были выпущены в качестве промо материалов, а одно является новым.","Издание ""Замков Бургундии"" 2019 года включает в себя одиннадцать расширений, десять из которых ранее были выпущены в качестве промо материалов, а одно является новым."
Великий западный путь. Новая Зеландия,https://tesera.ru/game/great-western-trail-new-zealand,6.65,9.31,8.50,2023,1 - 4,от 12 лет,75 - 150 мин,"https://s.tesera.ru/images/items/2114223,3/200x200xpa/photo1.jpg","Great Western Trail: New Zealand — самостоятельная игра серии Great Western Trail. Вы являетесь владельцем овечьей фермы, на Южном острове Новой Зеландии в конце 19 века. В последние годы ваша семейная ферма процветала благодаря диверсификации...","Great Western Trail: New Zealand— самостоятельная игра серииGreat Western Trail.Вы являетесь владельцем овечьей фермы, на Южном острове Новой Зеландии в конце 19 века. В последние годы ваша семейная ферма процветала благодаря диверсификации пород овец и увеличению стоимости вашей шерсти.С наступлением нового века появились новые проблемы. Вы должны приобретать новые и улучшенные породы овец, чтобы обеспечить процветание вашего семейного бизнеса и рабочих, которые на вас работают."
Сумеречная борьба: Делюкс издание,https://tesera.ru/game/twilight-struggle,8.08,8.50,8.48,"Twilight Struggle, 2005",2,от 14 лет,180 - 240 мин,"https://s.tesera.ru/images/items/2604,3/200x200xpa/photo1.jpg",Сумеречная Борьба моделирует события холодной войны между двумя сверхдержавами – США и Советским Союзом.,"Сумеречная Борьба— один из самых известных в мире варгеймов. Игра моделирует события холодной войны между двумя сверхдержавами — США и Советским Союзом. Конфликтующим сторонам необходимо наладить отношения с другими государствами, получить контроль над территориями и при этом не допустить развязывания ядерной войны.Игровое поле представляет собой карту мира, на которой отмечены страны и некоторые их особенности. Там же находится общая линейка подсчёта очков, начинающаяся с «-20» (победа СССР) и заканчивающаяся цифрой «20» (победа США). Цветными жетонами игроки отмечают на карте силу своего влияния на другие территории. В комплектСумеречной Борьбытакже входят 103 карты, каждая из которых может быть использована двумя способами: в качестве события, которое может влиять на одну или обе стороны конфликта, или же в качестве источника очков операций для воздействия на другие страны. Игроки получают по 8 карт и размещают часть своих жетонов влияния на карте — так начинается холодная война.Игровой процесс вСумеречной Борьберазбит на 10 раундов, каждый из которых соответствует определённому временному интервалу. В течение раунда игроки по очереди разыгрывают имеющиеся на руках карты, совершая при этом различные действия, например, увеличивая своё влияние в определённых странах, организовывая перевороты или же пытаясь обогнать соперника в «космической гонке». Также участникам приходится следить за важным параметром «DEFCON», отражающим напряжённость отношений. Если он уменьшается до единицы, начинается ядерная война, и игрок, развязавший её, сразу же считается проигравшим. Также в игре можно победить досрочно, набрав 20 победных очков или же получив полный контроль над Европой."
Звёздные Войны: Восстание. Рассвет Импер,https://tesera.ru/game/star-wars-rebellion-rise-of-the-empire,7.71,8.62,8.46,2017,2 - 4,,,"https://s.tesera.ru/images/items/996405,3/200x200xpa/photo1.jpg",Первое дополнение к популярной стратегической игре Star Wars: Rebellion.,"Дополнение разработано под впечатлением от блокбастера ""Звездные Войны: Изгой-1"", поэтому в нем есть множество героев, злодеев, кораблей и наземных отрядов из фильма наряду с персонажами, событиями и кораблями из мультсериала ""Звездные войны: Повстанцы"" и классической трилогии.Играя за Повстанцев вы можете отправить Джин Эрсо и Кассиана Эндора за чертежами Звезды Смерти, запутывая Имперцев фальшивыми приказами и операциями в тылу врага. Играя за Империю, можно руководить действиями Директора Кренника и его лучших Death Troopers, расставляя ловушки для повстанцев, уводя их от баз и вовлекая в масштабные бои. Обещано появление и Джаббы Хатта, которые предложит свои услуги Империи и будет кормить пленниками монстра Сарлака.Дополнение вводит в игру 8 новых лидеров, 36 миниатюр, 5 жетонов цели, 2 attchment кольца, 3 новых кубика и более 100 карт.Одна из особенностей дополнения в том, что сюжет игры будет развиваться с поправками на результаты миссиий, которые предпримут стороны в ходе партии. Кроме того, в игру добавляются колоды продвинутой тактики для обеих сторон конфликта. Они изменят ход сражения, задействуя уникальные способности юнитов.Издатель анонсировал выход дополнения Rise of the Empire в третьем квартале 2017 года."
Eclipse. Второй рассвет галактики,https://tesera.ru/game/eclipse-second-dawn-for-the-galaxy,7.97,8.51,8.45,"Eclipse: Second Dawn for the Galaxy, 2020",2 - 6,от 14 лет,60 - 200 мин,"https://s.tesera.ru/images/items/1207216,3/200x200xpa/photo1.png","Eclipse. Второй рассвет галактики (Eclipse: Second Dawn for the Galaxy) — это значительно переработанная версия игры Eclipse. Легендарная 4х-стратегия теперь с подправленным балансом, некоторыми включёнными дополнениями и современным дизайном.","Eclipse. Второй рассвет галактики (Eclipse: Second Dawn для Galax) — это значительно переработанная версия игры Eclipse. В этой 4-х стратегии игроки получают асимметричные способности и исследуют космос, заселяют планеты, вырабатывают ресурсы, строят конструкции и космические корабли, изучают технологии, позволяющие им улучшать производство и флот, сражаются с соперниками в открытом космосе и пытаются найти баланс между напором и осторожностью. Их цель — захватить власть в галактике, создав уникальную стратегию, наиболее подходящую их расе, чтобы подчинить или уничтожить соперников.Новое издание — это та же легендарная стратегия, но теперь с подправленным балансом, некоторыми включёнными дополнениями и современным дизайном. Визуальное оформление было обновлено для удобства игроков: изменён внешний вид планшетов, в издание включены игронайзеры от Game Trayz, индивидуальные кубики, линейка миниатюр Ship Pack 1, а также новые миниатюры древних, СЗЦГ, орбитальных станций и так далее. За годы существования оригинальной игры как игроки, так и разработчики сыграли огромное количество партий, которые породили ряд серьёзных обсуждений о возможных улучшениях. Разработчики прислушались к игрокам и собственному опыту и внесли изменения в правила: пересмотрено несколько основных принципов и подправлено множество мелких деталей, например стоимость технологий.Изучитьсписок измененийможно на сайте издательства Crowd Games."
Немезида,https://tesera.ru/game/nemesis,7.96,8.47,8.45,"Nemesis, 2018",1 - 5,от 12 лет,90 - 180 мин,"https://s.tesera.ru/images/items/1121402,3/200x200xpa/photo1.jpg",Немезида (Nemesis) – это полукооперативная игра с блефом в антураже научно-фантастического приключенческого фильма о выживании людей на космическом корабле вдали от цивилизации.,"Немезис - это научно-фантастическая игра на выживание для 1-5 игроков. Вы играете за команду космического корабля, которая по неведомым причинам вышла из гибернации. В регламенте действия при ЧС говорится, что такая ситуация может случиться из-за критической сбоя системы управления кораблём и из-за этого он не может продолжать полёт.Основная цель команды - разобраться в причинах происшествия и как-то разрешить эту ситуацию, чтобы безопасно вернуться на Землю. Наибольшая странность заключается в том, что один из членов команды погиб - кто-то разбил его гибернационную камеру и вытащил оттуда его тело. Если вы внимательно прислушаетесь, то различите какие-то шумы и звуки. Новые звуки, странные звуки, звуки, которых вам не доводилось до этого слышать…"
